{
  "schemaVersion": 1,
  "generatedAt": "2026-08-20T00:00:00Z",
  "canonicalRepo": {
    "repo": "caezium/skills",
    "url": "https://github.com/caezium/skills.git",
    "branch": "main",
    "auditedCommit": "018d2b15ae2b6b22f071ca0ee5fdc03065961e62"
  },
  "sources": {
    "anthropic-official": {
      "kind": "managed",
      "label": "Anthropic official Claude skill-creator package",
      "repo": null,
      "url": null,
      "branch": null,
      "pinnedCommit": null,
      "pinBasis": "managed-without-version",
      "lastCheckedAt": "2026-08-20T00:00:00Z"
    },
    "awesome-design": {
      "kind": "git",
      "label": "VoltAgent/awesome-design-md",
      "repo": "VoltAgent/awesome-design-md",
      "url": "https://github.com/VoltAgent/awesome-design-md.git",
      "branch": "main",
      "pinnedCommit": "8147538b4226ae41e2487a9179e3bcc1f68e8554",
      "pinBasis": "audited-remote-snapshot",
      "lastCheckedAt": "2026-08-20T00:00:00Z"
    },
    "claude-weekly": {
      "kind": "git",
      "label": "er1chu/claude-skills-weekly",
      "repo": "er1chu/claude-skills-weekly",
      "url": "https://github.com/er1chu/claude-skills-weekly.git",
      "branch": "main",
      "pinnedCommit": "32386d6e8b2ae0bc35a2bfc83684211e48b60991",
      "pinBasis": "local-clone-unverified-upstream",
      "lastCheckedAt": "2026-08-20T00:00:00Z"
    },
    "cloudflare": {
      "kind": "git",
      "label": "cloudflare/skills",
      "repo": "cloudflare/skills",
      "url": "https://github.com/cloudflare/skills.git",
      "branch": "main",
      "pinnedCommit": "f96bff754e428838818017f75817f0f9428acd48",
      "pinBasis": "audited-remote-snapshot",
      "lastCheckedAt": "2026-08-20T00:00:00Z"
    },
    "cursor-managed": {
      "kind": "managed",
      "label": "Cursor built-in tooling snapshot",
      "repo": null,
      "url": null,
      "branch": null,
      "pinnedCommit": null,
      "pinBasis": "managed-without-version",
      "lastCheckedAt": "2026-08-20T00:00:00Z"
    },
    "dmmulroy-dotfiles": {
      "kind": "git",
      "label": "dmmulroy/.dotfiles",
      "repo": "dmmulroy/.dotfiles",
      "url": "https://github.com/dmmulroy/.dotfiles.git",
      "branch": "main",
      "pinnedCommit": "a7beb729d3a29237a3a02cb84d53e70fa9ab76a1",
      "pinBasis": "audited-remote-snapshot",
      "lastCheckedAt": "2026-08-20T00:00:00Z"
    },
    "last30days": {
      "kind": "git",
      "label": "mvanhorn/last30days-skill",
      "repo": "mvanhorn/last30days-skill",
      "url": "https://github.com/mvanhorn/last30days-skill.git",
      "branch": "main",
      "pinnedCommit": "86a882510381532cf0d7aaacd96f87e1b5f3bf80",
      "pinBasis": "audited-remote-snapshot",
      "lastCheckedAt": "2026-08-20T00:00:00Z"
    },
    "matt": {
      "kind": "git",
      "label": "mattpocock/skills",
      "repo": "mattpocock/skills",
      "url": "https://github.com/mattpocock/skills.git",
      "branch": "main",
      "pinnedCommit": "0ab1b63a410a03d3627979a109c8695de27af954",
      "pinBasis": "audited-remote-snapshot",
      "lastCheckedAt": "2026-08-20T00:00:00Z"
    },
    "personal": {
      "kind": "git",
      "label": "caezium/skills",
      "repo": "caezium/skills",
      "url": "https://github.com/caezium/skills.git",
      "branch": "main",
      "pinnedCommit": "018d2b15ae2b6b22f071ca0ee5fdc03065961e62",
      "pinBasis": "canonical-repo",
      "lastCheckedAt": "2026-08-20T00:00:00Z"
    },
    "pstack": {
      "kind": "git",
      "label": "cursor/plugins pstack",
      "repo": "cursor/plugins",
      "url": "https://github.com/cursor/plugins.git",
      "branch": "main",
      "pinnedCommit": "51a96e0dd838404da19ba83dc70aa21eef71f868",
      "pinBasis": "audited-remote-snapshot",
      "lastCheckedAt": "2026-08-20T00:00:00Z"
    },
    "taste": {
      "kind": "git",
      "label": "Leonxlnx/taste-skill",
      "repo": "Leonxlnx/taste-skill",
      "url": "https://github.com/Leonxlnx/taste-skill.git",
      "branch": "main",
      "pinnedCommit": "dfb6f9f9e93a39f673b1827c0889cc28326d1800",
      "pinBasis": "audited-remote-snapshot",
      "lastCheckedAt": "2026-08-20T00:00:00Z"
    },
    "tech-digest": {
      "kind": "git",
      "label": "camilleroux/tech-digest",
      "repo": "camilleroux/tech-digest",
      "url": "https://github.com/camilleroux/tech-digest.git",
      "branch": "main",
      "pinnedCommit": "22c5f2e8c92fcb9ad168cb96ce5e8b5810be28ff",
      "pinBasis": "local-clone-unverified-upstream",
      "lastCheckedAt": "2026-08-20T00:00:00Z"
    },
    "tldraw-managed": {
      "kind": "managed",
      "label": "tldraw Desktop agent-skills installer",
      "repo": null,
      "url": null,
      "branch": null,
      "pinnedCommit": null,
      "pinBasis": "managed-without-version",
      "lastCheckedAt": "2026-08-20T00:00:00Z"
    }
  },
  "skills": [
    {"name":"1-1-prep","state":"active","kind":"vendored","sourceId":"claude-weekly","sourcePath":"skills/1-1-prep","sourceTree":"275a2520d41271e5258fc712e44c0ae25351ff03","content":{"kind":"sha256","value":"72d0be4b7773fc377e2a30296b7160b9e71e0bec1356d23402c6857e3b3f1dd1","basis":"integration-target-content"},"localOverlays":[],"updatePolicy":"reviewed-source-update","lastCheckedAt":"2026-08-20T00:00:00Z","notes":"Identical to local bundle clone at 32386d6; live source commit was not pinned"},
    {"name":"agents-sdk","state":"active","kind":"vendored","sourceId":"cloudflare","sourcePath":"skills/agents-sdk","sourceTree":"fe7c98385541543a62abf65090654fcbc181c8b7","content":{"kind":"sha256","value":"0d1444532e292e92000d63e5723c9b2b520ead7c2859e9a94b74145b34235eda","basis":"integration-target-content"},"localOverlays":[],"updatePolicy":"reviewed-source-update","lastCheckedAt":"2026-08-20T00:00:00Z","notes":"SKILL.md matches current upstream but mcp.md state-scheduling.md and streaming-chat.md hashes differ"},
    {"name":"anthropic-skill-creator","state":"active","kind":"vendored-overlay","sourceId":"anthropic-official","sourcePath":"plugins/skill-creator/skills/skill-creator","sourceTree":null,"content":{"kind":"sha256","value":"9167573088242d9db152bc5a551309f3843430618a85ca5eaf64ad62849cc822","basis":"integration-target-content"},"localOverlays":["renamed from skill-creator to avoid the Codex system-skill collision"],"updatePolicy":"reviewed-overlay-rebase","lastCheckedAt":"2026-08-20T00:00:00Z","notes":"Promoted into the canonical cross-harness repository during the 2026-08-20 remediation."},
    {"name":"app-screenshots","state":"active","kind":"custom","sourceId":"personal","sourcePath":"app-screenshots","sourceTree":"f06bc96f98d62192d5b03de9004a8439631e5280","content":{"kind":"sha256","value":"4d915642ad7306d84d1422c9263f285c1d89945190c656fd6c0609c55ff42a59","basis":"integration-target-content"},"localOverlays":[],"updatePolicy":"personal-repo","lastCheckedAt":"2026-08-20T00:00:00Z","notes":"Authored in personal repo; no external upstream asserted"},
    {"name":"app-store-preflight-compliance","state":"active","kind":"custom","sourceId":"personal","sourcePath":"app-store-preflight-compliance","sourceTree":null,"content":{"kind":"sha256","value":"8a6708ed504ac5983aa4c82b413499235b4470238d4228db0e73b17a123a4e90","basis":"integration-target-content"},"localOverlays":[],"updatePolicy":"personal-repo","lastCheckedAt":"2026-08-20T00:00:00Z","notes":"Canonical directory renamed from greenlight to match SKILL.md frontmatter."},
    {"name":"awesome-design-md","state":"active","kind":"vendored-overlay","sourceId":"awesome-design","sourcePath":"design-md","sourceTree":"21b9da9da72de8db3aa0eb4f850781cb11ec38f2","content":{"kind":"sha256","value":"08655cd6ce2651a96e3e69f98d0377564a3986e0ffa2d5baf3948252518e14d9","basis":"integration-target-content"},"localOverlays":["Henry wrapper SKILL.md over the pinned design-md references"],"updatePolicy":"reviewed-overlay-rebase","lastCheckedAt":"2026-08-20T00:00:00Z","notes":"Local references tree 21b9da9 exactly matches current upstream; SKILL.md is Henry's wrapper"},
    {"name":"blast-radius","state":"active","kind":"vendored-overlay","sourceId":"pstack","sourcePath":"pstack/skills/blast-radius","sourceTree":"b7e78173d1cee739737fa2371017a211ebe3fc8c","content":{"kind":"sha256","value":"2c3ddba1c35e0bc253ffbef0fc238de5e6813be9769536beaa5368f4c295f6db","basis":"integration-target-content"},"localOverlays":["portable cross-harness adaptation","vendored MIT license file"],"updatePolicy":"reviewed-overlay-rebase","lastCheckedAt":"2026-08-20T00:00:00Z","notes":"Portable pstack port from cursor/plugins@51a96e0dd838."},
    {"name":"brandkit","state":"active","kind":"vendored","sourceId":"taste","sourcePath":"skills/brandkit","sourceTree":"d278ff748cafab01e4ae5dd7758fc0b53258621c","content":{"kind":"sha256","value":"abf019fd8d2942e00d029742be9dab13731926a1cf078570c7c7a3aa636cfb1c","basis":"integration-target-content"},"localOverlays":[],"updatePolicy":"reviewed-source-update","lastCheckedAt":"2026-08-20T00:00:00Z","notes":"Exact Git tree SHA d278ff7 matches current upstream"},
    {"name":"bro","state":"active","kind":"vendored-overlay","sourceId":"dmmulroy-dotfiles","sourcePath":"home/.agents/skills/bro","sourceTree":"53c3b2c5dc11fe0ee4156468da27505df9239dc6","content":{"kind":"sha256","value":"108c6c18bb2f5c641ef283337a1714b13879a2ff88b24998848fdcfdda9d5bc5","basis":"integration-target-content"},"localOverlays":["appended upstream source-attribution comment"],"updatePolicy":"reviewed-overlay-rebase","lastCheckedAt":"2026-08-20T00:00:00Z","notes":"Pinned to dmmulroy/.dotfiles; local content adds only source attribution and overlaps pstack functionally"},